{
  "$schema": "https://json-schema.org/draft/2020-12/schema",
  "title": "PendingTruthPatch",
  "type": "object",
  "additionalProperties": false,
  "required": [
    "patch_id",
    "created_at",
    "task_id",
    "run_id",
    "target_files",
    "reason",
    "proposed_changes",
    "evidence_refs",
    "status"
  ],
  "properties": {
    "patch_id": {
      "type": "string"
    },
    "created_at": {
      "type": "string"
    },
    "task_id": {
      "type": "string"
    },
    "run_id": {
      "type": "string"
    },
    "target_files": {
      "type": "array",
      "items": {
        "type": "string"
      }
    },
    "reason": {
      "type": "string"
    },
    "proposed_changes": {
      "type": "array",
      "items": {
        "type": "object",
        "additionalProperties": false,
        "required": [
          "change_type",
          "target",
          "payload"
        ],
        "properties": {
          "change_type": {
            "type": "string"
          },
          "target": {
            "type": "string"
          },
          "payload": {}
        }
      }
    },
    "evidence_refs": {
      "type": "array",
      "items": {
        "type": "string"
      }
    },
    "status": {
      "type": "string",
      "enum": [
        "pending",
        "approved",
        "rejected",
        "applied"
      ]
    }
  }
}
