{
  "patch_id": "patch_leverage_truth_promotion_project_truth_v1",
  "created_at": "2026-04-03T10:35:00Z",
  "task_id": "task_20260403_081741_truth_patch_prep_leverage_truth_promotion",
  "run_id": "run_20260403_081741_truth_patch_prep_leverage_truth_promotion",
  "target_files": [
    "C:\\Users\\benda\\Desktop\\market_regime_v1\\source_of_truth\\project_truth.json"
  ],
  "reason": "Promote leverage branch structured decision state into official source_of_truth project_truth.json without direct app/live auto-switch.",
  "proposed_changes": [
    {
      "change_type": "replace_json_top_level_key",
      "target": "C:\\Users\\benda\\Desktop\\market_regime_v1\\source_of_truth\\project_truth.json",
      "payload": {
        "key": "leverage_branch_truth",
        "value": {
          "research_raw_winner": "phase68i_66g_1p50x_static",
          "best_deployment_candidate": "phase68i_dynamic_ladder_candidate",
          "official_softer_fallback": "phase68g_66g_1p25x_candidate",
          "phase68j_simple_tail_risk_guardrails": "rejected",
          "ordering_remains_unchanged": true,
          "truth_promotion_ready": true,
          "direct_auto_switch_app_live_approved": false
        }
      }
    }
  ],
  "evidence_refs": [
    "MASTER leverage decision truth message",
    "Phase68G forensic verdict clean",
    "Phase68H dynamic ladder candidate committed and pushed"
  ],
  "status": "applied"
}
